{
  "endpoints": [
    {
      "determinism": {
        "level": "low",
        "notes": "Model/provider inference output can vary across runs, seeds, and upstream model revisions."
      },
      "error_taxonomy": [
        {
          "code": "bad_request",
          "description": "Input validation failed for request payload/query.",
          "http_status": 400,
          "retryable": false
        },
        {
          "code": "payment_required",
          "description": "Payment header missing or underpaid for this route.",
          "http_status": 402,
          "retryable": false
        },
        {
          "code": "rate_limited",
          "description": "Rate limit reached; wait and retry.",
          "http_status": 429,
          "retryable": true
        },
        {
          "code": "upstream_unavailable",
          "description": "Provider unavailable or timed out; retry with backoff or fallback endpoint.",
          "http_status": 503,
          "retryable": true
        }
      ],
      "fallback_equivalents": [
        "embeddings",
        "face-swap"
      ],
      "final_cost": {
        "amount": 0.005,
        "currency": "USD",
        "includes_network_fees": false,
        "model": "flat",
        "notes": "Flat per-request endpoint fee; excludes L1/L2 settlement gas paid separately by payer."
      },
      "id": "code-run",
      "idempotency": "non_idempotent",
      "last_verified_at": "2026-02-25T00:00:00Z",
      "latency": {
        "p50_ms": 1800,
        "p95_ms": 9000,
        "timeout_ms": 45000
      },
      "method": "POST",
      "network_support": [
        "eip155:4326",
        "eip155:8453",
        "solana:5eykt4UsFv8P8NJdTREpY1vzqKqZKvdp"
      ],
      "path": "/api/code/run",
      "price": "$0.005",
      "refund_policy": {
        "contact": "support@x402engine.app",
        "policy": "Case-by-case refunds for provider outages, duplicate charges, or gateway faults.",
        "sla_hours": 24
      },
      "uptime_slo": {
        "target_pct": 99.5,
        "window_days": 30
      }
    },
    {
      "determinism": {
        "level": "high",
        "notes": "Read-only retrieval endpoint; response may vary with market/provider freshness."
      },
      "error_taxonomy": [
        {
          "code": "bad_request",
          "description": "Input validation failed for request payload/query.",
          "http_status": 400,
          "retryable": false
        },
        {
          "code": "payment_required",
          "description": "Payment header missing or underpaid for this route.",
          "http_status": 402,
          "retryable": false
        },
        {
          "code": "rate_limited",
          "description": "Rate limit reached; wait and retry.",
          "http_status": 429,
          "retryable": true
        },
        {
          "code": "upstream_unavailable",
          "description": "Provider unavailable or timed out; retry with backoff or fallback endpoint.",
          "http_status": 503,
          "retryable": true
        }
      ],
      "fallback_equivalents": [
        "crypto-markets",
        "crypto-price"
      ],
      "final_cost": {
        "amount": 0.003,
        "currency": "USD",
        "includes_network_fees": false,
        "model": "flat",
        "notes": "Flat per-request endpoint fee; excludes L1/L2 settlement gas paid separately by payer."
      },
      "id": "crypto-history",
      "idempotency": "idempotent",
      "last_verified_at": "2026-02-25T00:00:00Z",
      "latency": {
        "p50_ms": 250,
        "p95_ms": 1200,
        "timeout_ms": 10000
      },
      "method": "GET",
      "network_support": [
        "eip155:4326",
        "eip155:8453",
        "solana:5eykt4UsFv8P8NJdTREpY1vzqKqZKvdp"
      ],
      "path": "/api/crypto/history",
      "price": "$0.003",
      "refund_policy": {
        "contact": "support@x402engine.app",
        "policy": "Case-by-case refunds for provider outages, duplicate charges, or gateway faults.",
        "sla_hours": 24
      },
      "uptime_slo": {
        "target_pct": 99.5,
        "window_days": 30
      }
    },
    {
      "determinism": {
        "level": "high",
        "notes": "Read-only retrieval endpoint; response may vary with market/provider freshness."
      },
      "error_taxonomy": [
        {
          "code": "bad_request",
          "description": "Input validation failed for request payload/query.",
          "http_status": 400,
          "retryable": false
        },
        {
          "code": "payment_required",
          "description": "Payment header missing or underpaid for this route.",
          "http_status": 402,
          "retryable": false
        },
        {
          "code": "rate_limited",
          "description": "Rate limit reached; wait and retry.",
          "http_status": 429,
          "retryable": true
        },
        {
          "code": "upstream_unavailable",
          "description": "Provider unavailable or timed out; retry with backoff or fallback endpoint.",
          "http_status": 503,
          "retryable": true
        }
      ],
      "fallback_equivalents": [
        "crypto-history",
        "crypto-price"
      ],
      "final_cost": {
        "amount": 0.002,
        "currency": "USD",
        "includes_network_fees": false,
        "model": "flat",
        "notes": "Flat per-request endpoint fee; excludes L1/L2 settlement gas paid separately by payer."
      },
      "id": "crypto-markets",
      "idempotency": "idempotent",
      "last_verified_at": "2026-02-25T00:00:00Z",
      "latency": {
        "p50_ms": 250,
        "p95_ms": 1200,
        "timeout_ms": 10000
      },
      "method": "GET",
      "network_support": [
        "eip155:4326",
        "eip155:8453",
        "solana:5eykt4UsFv8P8NJdTREpY1vzqKqZKvdp"
      ],
      "path": "/api/crypto/markets",
      "price": "$0.002",
      "refund_policy": {
        "contact": "support@x402engine.app",
        "policy": "Case-by-case refunds for provider outages, duplicate charges, or gateway faults.",
        "sla_hours": 24
      },
      "uptime_slo": {
        "target_pct": 99.5,
        "window_days": 30
      }
    },
    {
      "determinism": {
        "level": "high",
        "notes": "Read-only retrieval endpoint; response may vary with market/provider freshness."
      },
      "error_taxonomy": [
        {
          "code": "bad_request",
          "description": "Input validation failed for request payload/query.",
          "http_status": 400,
          "retryable": false
        },
        {
          "code": "payment_required",
          "description": "Payment header missing or underpaid for this route.",
          "http_status": 402,
          "retryable": false
        },
        {
          "code": "rate_limited",
          "description": "Rate limit reached; wait and retry.",
          "http_status": 429,
          "retryable": true
        },
        {
          "code": "upstream_unavailable",
          "description": "Provider unavailable or timed out; retry with backoff or fallback endpoint.",
          "http_status": 503,
          "retryable": true
        }
      ],
      "fallback_equivalents": [
        "crypto-markets",
        "token-prices"
      ],
      "final_cost": {
        "amount": 0.001,
        "currency": "USD",
        "includes_network_fees": false,
        "model": "flat",
        "notes": "Flat per-request endpoint fee; excludes L1/L2 settlement gas paid separately by payer."
      },
      "id": "crypto-price",
      "idempotency": "idempotent",
      "last_verified_at": "2026-02-25T00:00:00Z",
      "latency": {
        "p50_ms": 250,
        "p95_ms": 1200,
        "timeout_ms": 10000
      },
      "method": "GET",
      "network_support": [
        "eip155:4326",
        "eip155:8453",
        "solana:5eykt4UsFv8P8NJdTREpY1vzqKqZKvdp"
      ],
      "path": "/api/crypto/price",
      "price": "$0.001",
      "refund_policy": {
        "contact": "support@x402engine.app",
        "policy": "Case-by-case refunds for provider outages, duplicate charges, or gateway faults.",
        "sla_hours": 24
      },
      "uptime_slo": {
        "target_pct": 99.5,
        "window_days": 30
      }
    },
    {
      "determinism": {
        "level": "high",
        "notes": "Read-only retrieval endpoint; response may vary with market/provider freshness."
      },
      "error_taxonomy": [
        {
          "code": "bad_request",
          "description": "Input validation failed for request payload/query.",
          "http_status": 400,
          "retryable": false
        },
        {
          "code": "payment_required",
          "description": "Payment header missing or underpaid for this route.",
          "http_status": 402,
          "retryable": false
        },
        {
          "code": "rate_limited",
          "description": "Rate limit reached; wait and retry.",
          "http_status": 429,
          "retryable": true
        },
        {
          "code": "upstream_unavailable",
          "description": "Provider unavailable or timed out; retry with backoff or fallback endpoint.",
          "http_status": 503,
          "retryable": true
        }
      ],
      "fallback_equivalents": [
        "crypto-history",
        "crypto-markets"
      ],
      "final_cost": {
        "amount": 0.001,
        "currency": "USD",
        "includes_network_fees": false,
        "model": "flat",
        "notes": "Flat per-request endpoint fee; excludes L1/L2 settlement gas paid separately by payer."
      },
      "id": "crypto-search",
      "idempotency": "idempotent",
      "last_verified_at": "2026-02-25T00:00:00Z",
      "latency": {
        "p50_ms": 250,
        "p95_ms": 1200,
        "timeout_ms": 10000
      },
      "method": "GET",
      "network_support": [
        "eip155:4326",
        "eip155:8453",
        "solana:5eykt4UsFv8P8NJdTREpY1vzqKqZKvdp"
      ],